pid	English	Chinese
918904	Embellished matelassé velvet shoulder bag	带缀饰马特拉塞凸纹天鹅绒单肩包
919607	Crepe-trimmed stretch-twill mini dress	绉纱边饰弹力斜纹布迷你连衣裙
895834	Embellished velvet Mary Jane pumps	缀饰天鹅绒玛丽珍高跟鞋
919618	Embellished appliquéd wool-felt bomber jacket	带缀饰贴花羊毛毡飞行员夹克
893351	Crystal-embellished velvet waist belt	水晶缀饰天鹅绒腰带
895382	Ruffle-trimmed cady mini skirt	荷叶边边饰卡迪面料迷你半身裙
897411	Club matelassé leather shoulder bag	Club 马特拉塞凸纹皮革单肩包
895361	Ruffle-trimmed embellished wool and silk-blend mini dress	褶饰装饰羊毛真丝混纺迷你连衣裙
895836	Embellished satin point-toe flats	带缀饰缎布尖头平底鞋
895389	Embellished silk satin-trimmed pleated crepe blouse	缀饰丝缎边饰褶裥绉纱女衫
895830	Embellished velvet pumps	带缀饰天鹅绒高跟鞋
919625	Cropped checked wool flared pants	格纹羊毛九分喇叭裤
897410	Suede-trimmed velvet clutch 	绒面革边饰天鹅绒手拿包
895360	Embellished ruffled wool and silk-blend mini dress	带缀饰荷叶边羊毛真丝混纺迷你连衣裙
895815	Velvet platform boots	天鹅绒防水台短靴
895394	Pussy-bow embellished pleated crepe de chine blouse	蝴蝶结饰褶裥双绉女衫
893401	Silver-tone faux pearl and crystal ring	人造珍珠水晶银色戒指
895379	Cropped grain de poudre stretch-wool flared pants	粒纹弹力羊毛九分喇叭裤
811000	Club matelassé leather shoulder bag	Club 马特拉塞凸纹皮革单肩包
919614	Embellished crepe midi dress	带缀饰绉纱中长连衣裙
895850	Crystal-embellished satin sandals	水晶缀饰缎布凉鞋
897399	Textured-leather wallet	纹理皮革钱包
897403	Textured-leather wallet	纹理皮革钱包
897416	Printed textured-leather cardholder	印花纹理皮革卡夹
897401	Miu Lady embellished smooth and textured-leather shoulder bag	Miu Lady 缀饰光滑纹理皮革单肩包
895367	Appliquéd velvet bomber jacket	贴花天鹅绒机车夹克
895847	Studded shearling slippers	铆钉羊毛皮拖鞋
895368	Cropped crystal-embellished feather jacket	水晶缀饰羽毛短款夹克
895823	Appliquéd glittered leather sneakers	贴花亮片金葱皮革运动鞋
919621	Cropped intarsia wool sweater	短款嵌花毛衣
897400	Miu Click textured-leather tote	Miu Click 纹理皮革手提包
895356	Velvet-trimmed double-breasted checked wool-blend peacoat	天鹅绒边饰双排扣格纹羊毛混纺水手外套
895842	Glittered patent-leather pumps	亮片金葱漆皮高跟鞋
895392	Broderie anglaise-trimmed silk crepe de chine top	马德拉刺绣边饰真丝双绉上衣
918744	Silver-tone, crystal and faux pearl clip earrings	水晶、人造珍珠、银色夹扣式耳环
918740	Striped stretch-wool socks	条纹弹力羊毛短袜
895369	Broderie anglaise-trimmed high-rise straight-leg jeans	马德拉刺绣边饰高腰直筒牛仔裤
919616	Cropped houndstooth wool-tweed bomber jacket	千鸟格羊毛花呢短款飞行员夹克
897407	Miu Click textured-leather tote	Miu Click 纹理皮革手提包
895357	Open-back cady mini dress	露背卡迪面料连衣裙
895844	Lace-up metallic leather ballet flats	绑带式金属感皮革芭蕾平底鞋
895355	Broderie anglaise-trimmed twill jacket	马德拉刺绣边饰斜纹布外套  
895826	Embellished velvet pumps	带缀饰天鹅绒高跟鞋
895387	Ruffle-trimmed cady mini skirt	荷叶边边饰卡迪面料迷你半身裙
861016	Appliquéd leather bucket bag	贴花皮革水桶包
895363	Ruffled cady mini dress	荷叶边卡迪面料迷你连衣裙
895824	Glittered velvet platform sandals	亮片金葱天鹅绒防水台凉鞋
895390	Satin-trimmed silk crepe de chine shirt	缎布边饰真丝双绉衬衫
895817	Textured-leather platform sandals	纹理皮革防水台凉鞋
895385	Houndstooth wool-tweed skirt	千鸟格羊毛花呢半身裙
886232	Round-frame acetate, twill and gold-tone sunglasses	圆框板材斜纹布金色太阳镜 
886231	Embellished cat-eye acetate and gold-tone sunglasses	带缀饰板材金色猫眼太阳镜
886228	Square-frame glittered acetate sunglasses	亮片金葱板材方框太阳镜
893396	Silver-plated, crystal and faux pearl earrings	水晶人造珍珠镀银耳环
895362	Broderie anglaise-trimmed denim mini dress	马德拉刺绣边饰牛仔迷你连衣裙
895814	Leather platform boots	皮革防水台短靴
895366	Faux shearling-trimmed appliquéd denim jacket	人造羊毛皮边饰贴花牛仔夹克
886230	Cat-eye silver-tone mirrored sunglasses	银色金属猫眼镜面太阳镜
895386	Broderie anglaise-trimmed denim mini skirt	马德拉刺绣边饰牛仔迷你半身裙
893381	Velvet, silver-tone, crystal and faux pearl choker	天鹅绒、水晶、人造珍珠、银色项圈式项链
895364	Appliquéd denim mini dress	贴花牛仔布迷你连衣裙
895832	Crystal-embellished leather-trimmed velvet ballet flats	水晶缀饰皮革边饰天鹅绒芭蕾平底鞋
895388	Appliquéd denim shirt	贴花牛仔衬衫
886229	Embellished round-frame acetate sunglasses	带缀饰圆框板材太阳镜
919629	Ruffled cotton Oxford shirt	褶饰纯棉牛津布衬衫
895391	Lace-trimmed cotton-piqué polo shirt	蕾丝边饰纯棉泡泡纱 Polo 衫
895813	Crystal-embellished suede ankle boots	水晶缀饰绒面革踝靴
895373	Broderie anglaise-trimmed cashmere and silk-blend sweater	马德拉刺绣边饰羊绒真丝混纺毛衣
895838	Embellished velvet mules	带缀饰天鹅绒穆勒鞋
810998	Matelassé leather camera bag	马特拉塞凸纹皮革相机包
895358	Sequined cady and chiffon mini dress	带亮片卡迪面料雪纺绸迷你连衣裙
893356	Beaded felt, velvet and metallic textured-leather keychain	细珠毛毡天鹅绒金属感纹理皮革钥匙扣
895393	Lace-trimmed cotton-piqué polo shirt	蕾丝边饰纯棉泡泡纱 Polo 衫
830811	Crystal-embellished cat-eye acetate sunglasses 	水晶缀饰板材猫眼太阳镜
895381	Pleated floral-print denim shorts	褶裥花朵印花牛仔短裤
895829	Lace-up leather-trimmed leopard-print calf hair ballet flats	绑带皮革边饰豹纹小牛毛芭蕾平底鞋
907097	Lace-up leather ballet flats	绑带式皮革芭蕾平底鞋
895828	Lace-up leather-trimmed satin ballet flats	 绑带式皮革边饰缎布芭蕾平底鞋
811295	Cropped embellished crepe jacket	带缀饰绉纱短款外套
807892	Gold and silver-plated, faux pearl and crystal clip earrings	人造珍珠、水晶、镀金、镀银夹扣式耳环
895380	Grain de poudre stretch-wool wide-leg pants	粒纹弹力羊毛阔腿裤
740057	Patent leather-trimmed velvet shoulder bag 	漆皮边饰天鹅绒单肩包
821369	Embellished cotton-jacquard dress	带缀饰纯棉提花连衣裙
917140	Embellished satin pumps	带缀饰缎布中跟鞋
811320	Broderie anglaise cotton top	马德拉刺绣纯棉上衣
807896	Gold-plated, faux pearl and crystal necklace	人造珍珠、水晶、镀金项链
821377	Checked cotton-voile wrap midi skirt	格纹纯棉巴里纱围裹式中长半身裙
861018	Appliquéd leather bucket bag	贴花皮革水桶包
861582	Floral-appliquéd silk-blend cloqué wrap dress	花卉贴花真丝混纺泡泡纱裹身连衣裙
895848	Embellished satin pumps	带缀饰缎布高跟鞋
811322	Ruffle-trimmed striped cotton-poplin shirt	褶饰边条纹纯棉府绸衬衫
861383	Canvas-trimmed metallic leather sandals	帆布边饰金属感皮革凉鞋
821376	Printed cotton-voile skirt	印花纯棉巴里纱半身裙
861919	Embellished faux patent-leather headband	带缀饰人造漆皮发箍
811284	Studded suede mini dress	钉饰绒面革迷你连衣裙
895822	Velvet-trimmed suede platform sandals	天鹅绒边饰绒面革防水台凉鞋
811294	Appliquéd satin bomber jacket	贴花缎布飞行员夹克
811293	Studded suede jacket	铆钉绒面革外套
811292	Embellished cady jacket 	带缀饰卡迪面料外套
861591	Smocked embroidered poplin top	皱褶装饰刺绣府绸上衣
861587	Smocked embroidered cotton-poplin briefs	缩褶刺绣纯棉府绸短裤
861590	Pleated cotton-poplin wrap skirt	褶裥纯棉府绸围裹式半身裙
811265	Belted cotton-blend gabardine trench coat	配腰带棉质混纺华达呢风衣
895840	Faux pearl-embellished patent-leather point-toe flats	人造珍珠缀饰漆皮尖头平底鞋
893403	Silver-tone, Swarovski crystal and faux pearl necklace 	施华洛世奇水晶、人造珍珠、银色项链
821366	Oversized sequin-embellished faux patent-leather coat	亮片缀饰人造漆皮大廓形外套
821367	Embellished printed stretch-crepe midi dress	带缀饰印花弹力绉纱中长连衣裙
861594	Cutout floral-jacquard halterneck bodysuit	挖剪花卉提花挂脖连体紧身衣
811312	Embellished cady mini skirt	带缀饰卡迪面料迷你半身裙
811314	Embellished cady mini skirt	带缀饰卡迪面料迷你半身裙
861586	Embroidered smocked cotton shorts	刺绣皱褶装饰纯棉短裤
861589	Pleated cotton skirt	褶裥纯棉半身裙
881998	Shearling-trimmed buckled leather sneakers	羊毛皮边饰搭扣皮革运动鞋
797965	Swarovski crystal and feather-embellished satin and leather slides	施华洛世奇水晶羽毛缀饰缎布皮革拖鞋
797940	Glittered leather espadrille platform sandals	亮片金葱皮革厚麻底凉鞋
861922	Embellished faux glossed-leather hat	带缀饰人造亮面皮革帽
861382	Embellished faux shearling slides	带缀饰人造羊毛皮拖鞋
807910	Crystal-embellished silver-plated and glittered enamel keychain	水晶缀饰镀银亮片金葱搪瓷钥匙扣
861920	Bow-embellished textured-leather cosmetics case	蝴蝶结缀饰纹理皮革化妆包
761429	Embellished satin pumps	带缀饰缎布高跟鞋
797947	Crystal-embellished patent-leather pumps	水晶缀饰漆皮中跟鞋
797941	Leather-trimmed satin platform espadrilles	皮革边饰缎布厚麻底鞋
843236	Lace-up leather ballet flats	绑带式皮革芭蕾平底鞋
861384	Embellished satin slides 	带缀饰缎布拖鞋
797952	Metal-trimmed leather platform slip-on sneakers	金属边饰皮革防水台套穿运动鞋
710476	Crystal-embellished leather over-the-knee boots	水晶缀饰皮革过膝长靴
